{
  "feature_id": "ORD-CANCEL-02",
  "title": "Order Cancellation with Partial Refund",
  "source_refs": [
    {
      "id": "MD-order-cancel-partial",
      "kind": "spec",
      "excerpt": "Ingested from order-cancel-partial.md"
    }
  ],
  "summary": "Allow users to cancel orders and receive partial refunds when coupons were applied.",
  "actors": [
    "buyer",
    "system",
    "payment_gateway"
  ],
  "acceptance_criteria": [
    "AC-1: User can cancel order within 30 minutes of placement",
    "AC-2: System calculates refund amount minus coupon value",
    "AC-3: Refund is processed within 24 hours",
    "AC-4: User receives confirmation email with refund details"
  ],
  "business_rules": [
    "BR-1: Cancellation not allowed after order is shipped",
    "BR-2: Coupon value is not refunded (absorbed by platform)",
    "BR-3: Minimum refund amount is 0 (no negative refunds)"
  ],
  "devices": [
    "Web",
    "Mobile App",
    "API"
  ],
  "changed_areas": [
    "order_service",
    "payment_service",
    "notification_service",
    "refund_calculator"
  ],
  "revision": "spec-rev-1"
}
