{
  "feature_id": "ORDER-CANCELINPUT",
  "title": "order-cancel.input",
  "source_refs": [
    {
      "id": "MD-order-cancel.input",
      "kind": "spec",
      "excerpt": "Ingested from order-cancel.input.md"
    }
  ],
  "acceptance_criteria": [
    "AC-1: 出荷前の注文のみキャンセルできる。",
    "AC-2: 出荷済み注文はキャンセル不可メッセージを表示する。",
    "AC-3: キャンセル成功時は在庫を戻す。",
    "AC-4: クーポン利用注文ではクーポン残数を復元する。"
  ],
  "business_rules": [
    "BR-1: 決済失敗注文はキャンセル済み扱いにしない。",
    "BR-2: 二重キャンセルは不可。",
    "BR-3: CS 担当は購入者依頼を受けて代理キャンセルできる。"
  ],
  "changed_areas": [
    "order_detail",
    "inventory_service",
    "coupon_service"
  ],
  "revision": "spec-rev-1"
}
