{
  "feature_id": "ADMIN-ROLE-CHANGE-01",
  "title": "管理者権限変更機能",
  "summary": "ownerとadminが許可された範囲でワークスペース内ユーザーのロールを変更する。変更は即時反映し監査ログへ記録する。",
  "actors": [
    "owner",
    "admin",
    "editor",
    "viewer",
    "member",
    "system"
  ],
  "acceptance_criteria": [
    "ownerはmemberのロールを変更できる",
    "adminはviewer/editorのロールを変更できるがownerは変更できない",
    "viewer/editorはロールを変更できない",
    "最後のownerは降格できない",
    "ロール変更後、対象ユーザーの権限が即時反映される"
  ],
  "business_rules": [
    "自分自身のowner降格は禁止",
    "招待中ユーザーにはロール変更ではなく招待更新を使う",
    "監査ログにactor, target, before_role, after_roleを記録する"
  ],
  "changed_areas": [
    "workspace_members",
    "role_policy",
    "audit_log",
    "invitation_flow"
  ],
  "devices": [
    "Web"
  ],
  "source_refs": [
    {
      "id": "AC-1",
      "kind": "ac",
      "excerpt": "ownerはmemberのロールを変更できる"
    },
    {
      "id": "AC-2",
      "kind": "ac",
      "excerpt": "adminはviewer/editorのロールを変更できるがownerは変更できない"
    },
    {
      "id": "AC-3",
      "kind": "ac",
      "excerpt": "viewer/editorはロールを変更できない"
    },
    {
      "id": "AC-4",
      "kind": "ac",
      "excerpt": "最後のownerは降格できない"
    },
    {
      "id": "AC-5",
      "kind": "ac",
      "excerpt": "ロール変更後、対象ユーザーの権限が即時反映される"
    },
    {
      "id": "BR-1",
      "kind": "rule",
      "excerpt": "自分自身のowner降格は禁止"
    },
    {
      "id": "BR-2",
      "kind": "rule",
      "excerpt": "招待中ユーザーにはロール変更ではなく招待更新を使う"
    },
    {
      "id": "BR-3",
      "kind": "rule",
      "excerpt": "監査ログにactor, target, before_role, after_roleを記録する"
    }
  ],
  "assumptions": [
    {
      "id": "ASM-1",
      "text": "Session terminationは最大5秒で完了",
      "severity": "medium",
      "impact_on_coverage": "Session state checkに待機時間を含める"
    }
  ],
  "revision": "spec-rev-1"
}
